{
  "schema_version": "asi_stack.claim_chapter_review.v0",
  "chapter_id": "learning-theory-generalization-and-scaling-science",
  "review_state": "completed",
  "semantic_sweep": {
    "reviewed_source": "chapters/learning-theory-generalization-and-scaling-science.qmd",
    "structured_atoms_reviewed": 34,
    "prose_candidates_adjudicated": 53,
    "unowned_material_claims": 0,
    "review_note": "Re-reviewed the complete chapter through the P6.9 concept expansion on 2026-07-28. Every new claim-bearing sentence is reconciled to the exact concept-to-atom ownership recorded by the current-digest chapter substance contract, or classified as bounded source reporting. No new atom, unowned material claim, support transition, efficacy inference, release decision, or publication claim was introduced."
  },
  "chapter_defaults": {
    "review_state": "semantically_reviewed",
    "scope": {
      "population": "Versioned Learning Theory, Generalization, and Scaling Science decisions and artifacts within the bounded populations explicitly named by the chapter; universal ASI behavior is outside current evidence.",
      "environment": "The authored ASI Stack interfaces, future controlled fixtures, and prospectively frozen natural or adversarial workloads; production deployment and open-world transfer remain unestablished.",
      "model": "Model- and substrate-agnostic contract design at argument support; any implementation claim must name exact models, checkpoints, policies, prompts, tools, data, and evaluators.",
      "authority": "`learning-theory-generalization-and-scaling-science` owns its bounded decision contract; adjacent chapters retain their own authority, and neither prose nor a passing record can widen an action grant.",
      "time": "Semantic review current through 2026-07-28; material changes to evidence, authority, population, model, environment, ontology, consumer, or contracted concept prose require reauthorization.",
      "artifact": "chapters/learning-theory-generalization-and-scaling-science.qmd, its manifest record, source crosswalk (the chapter source packet), claim dossier, and future versioned implementation/evaluation receipts."
    },
    "assumptions": [
      "The distinct lifecycle owned by Learning Theory, Generalization, and Scaling Science can be represented without collapsing neighboring authority or evidence states.",
      "Identities, versions, complete attempt denominators, expiry, consumers, and residuals can be preserved across the chapter's interfaces.",
      "Future independent implementations and evaluators can test the claimed mechanism without treating record completeness as outcome success."
    ],
    "strongest_counterclaim": "A simpler composition of adjacent controls can govern the complete Learning Theory, Generalization, and Scaling Science lifecycle with equal safety, usefulness, legibility, and lower cost, making this separate owner unnecessary.",
    "falsifier": "A reachable trace violates a load-bearing Learning Theory, Generalization, and Scaling Science invariant, a required field has no exercised consumer, or a competent matched simpler system dominates the chapter's joint usefulness/safety/cost frontier.",
    "required_lanes": [
      {
        "lane": "source-synthesis",
        "necessity": "Position every mechanism and limitation against the dated primary-source packet without converting source-reported outcomes into local evidence."
      },
      {
        "lane": "normative",
        "necessity": "Justify authority, affected-party, refusal, correction, remedy, expiry, and acceptable-cost choices rather than hiding them in implementation."
      },
      {
        "lane": "formal",
        "necessity": "Model the load-bearing identities, routes, invalid states, non-substitution boundaries, and reachable counterexamples at the exact encoded scope."
      },
      {
        "lane": "executable",
        "necessity": "Exercise every required field and consumer with valid traces, targeted mutations, complete attempts, and effect-visible rejection paths."
      },
      {
        "lane": "empirical",
        "necessity": "Measure useful outcomes jointly with unsafe release, false refusal, missed help, latency, resources, human burden, and unresolved residuals."
      },
      {
        "lane": "causal",
        "necessity": "Use matched ablations and mechanism-specific controls to distinguish the proposed owner from task, model, evaluator, and implementation effects."
      },
      {
        "lane": "transfer",
        "necessity": "Repeat across prospectively declared populations, models, environments, implementations, evaluators, and failure regimes before broadening the claim."
      }
    ],
    "contrary_evidence": [
      "Adjacent controls or a simpler workflow may preserve the same bounded outcome at lower lifecycle cost.",
      "The proposed records can add latency, burden, false refusal, privacy exposure, bureaucracy, or new attack surfaces without improving outcomes.",
      "Current support is argument-level prose and source synthesis, not a local causal, transfer, deployment, or state-of-the-art result."
    ],
    "known_confounds": [
      "Shared authorship among architecture, implementation, benchmark, and evaluation can inflate apparent coherence or success.",
      "Synthetic tasks, weak comparators, tuning asymmetry, contamination, denominator loss, and line-of-code completeness can produce false positive or false negative conclusions."
    ],
    "acceptance_criteria": [
      "Every owned identity, authority, lifecycle state, failure distinction, consumer, expiry condition, and residual has an exercised consequence.",
      "A prospective campaign beats strong matched alternatives on the frozen joint usefulness/safety/cost rule under independent evaluation."
    ],
    "narrowing_criteria": [
      "Limit every conclusion to the exact tested population, environment, model, implementation, evaluator, authority, time window, metric, and failure family.",
      "A weak implementation or insensitive instrument narrows that attempt; it does not refute the architecture."
    ],
    "refutation_criteria": [
      "Refute an invariant when a reachable admitted trace violates it.",
      "Refute claimed benefit when a competent full attempt with positive controls and strong comparators fails its preregistered joint gate."
    ],
    "deprecation_criteria": [
      "Deprecate only when another owner subsumes the full lifecycle and every consumer, record, obligation, and residual migrates with lineage."
    ],
    "promotion_ceiling": "argument_until_claim_specific_full_attempt_and_accepted_evidence_transition",
    "reproduction": {
      "command": null,
      "environment_lock": null,
      "artifact_digest": null,
      "evaluator_identity": null
    },
    "terminal_disposition": null,
    "residual": {
      "owner": "learning-theory-generalization-and-scaling-science",
      "next_unblocking_condition": "Freeze the chapter-specific implementation, strong comparators, positive and negative controls, independent evaluators, joint metrics, stopping rule, and transfer set before running a full attempt."
    },
    "non_claims": [
      "Admission to the live book and semantic review establish chapter ownership and bounded argument, not mechanism efficacy.",
      "Source-reported results, schemas, diagrams, fixtures, or finite formal checks do not establish transfer, deployment readiness, SOTA, AGI, or ASI.",
      "No support state changes without a separate accepted evidence-transition record."
    ]
  },
  "atom_reviews": {},
  "prose_candidate_dispositions": {
    "learning-theory-generalization-and-scaling-science.prose.08f8665ec4dc": {
      "state": "duplicate_of_atom",
      "rationale": "Semantically reviewed as a prose explanation or refinement of `learning-theory-generalization-and-scaling-science.problem.001` within the chapter's declared scope; it creates no separate support-bearing atom.",
      "target_atom_id": "learning-theory-generalization-and-scaling-science.problem.001"
    },
    "learning-theory-generalization-and-scaling-science.prose.0aebb2ca8980": {
      "state": "duplicate_of_atom",
      "rationale": "Semantically reviewed after W3 as a chapter-specific stronger-alternative or ownership-boundary refinement of `learning-theory-generalization-and-scaling-science.insufficiency.001`; it creates no separate support-bearing atom.",
      "target_atom_id": "learning-theory-generalization-and-scaling-science.insufficiency.001"
    },
    "learning-theory-generalization-and-scaling-science.prose.0fc76be74e0f": {
      "state": "duplicate_of_atom",
      "rationale": "Semantically reviewed as a prose explanation or refinement of `learning-theory-generalization-and-scaling-science.insufficiency.001` within the chapter's declared scope; it creates no separate support-bearing atom.",
      "target_atom_id": "learning-theory-generalization-and-scaling-science.insufficiency.001"
    },
    "learning-theory-generalization-and-scaling-science.prose.0fc84513da71": {
      "state": "duplicate_of_atom",
      "rationale": "Semantically reviewed as a prose explanation or refinement of `learning-theory-generalization-and-scaling-science.mechanism.005` within the chapter's declared scope; it creates no separate support-bearing atom.",
      "target_atom_id": "learning-theory-generalization-and-scaling-science.mechanism.005"
    },
    "learning-theory-generalization-and-scaling-science.prose.10f5e131a70f": {
      "state": "duplicate_of_atom",
      "rationale": "Semantically reviewed after W3 as a chapter-specific scope guardrail of `learning-theory-generalization-and-scaling-science.core`; it creates no separate support-bearing atom.",
      "target_atom_id": "learning-theory-generalization-and-scaling-science.core"
    },
    "learning-theory-generalization-and-scaling-science.prose.1acfbb1c6d17": {